{
  "schema_version": "1.0.0",
  "producer": {
    "kind": "script",
    "name": "dev-state.sh",
    "version": "1.0.0"
  },
  "generated_at": "2026-08-12T00:00:00Z",
  "mode": "summary",
  "repository": {
    "root": "/workspace/kb-app",
    "branch": "feature/context-pack",
    "head": "aaaaaaaaaaaaaaaaaaaaaaaaaaaaaaaaaaaaaaaa",
    "dirty": false,
    "state_stamp": "sha256:bbbbbbbbbbbbbbbbbbbbbbbbbbbbbbbbbbbbbbbbbbbbbbbbbbbbbbbbbbbbbbbb",
    "changes": {
      "staged": 0,
      "unstaged": 0,
      "untracked": 0
    }
  },
  "checks": {
    "validity": "valid",
    "scope": "partial",
    "result": "passed",
    "recorded_scope": "partial",
    "recorded_result": "passed",
    "recorded_at": "2026-08-12T00:00:00Z",
    "recorded_state_stamp": "sha256:bbbbbbbbbbbbbbbbbbbbbbbbbbbbbbbbbbbbbbbbbbbbbbbbbbbbbbbbbbbbbbbb",
    "commands": [
      {
        "command": "python3 tests/context-pack/test_contract.py",
        "exit_code": 0
      }
    ]
  },
  "handoff": {
    "status": "adopted",
    "source": "local",
    "source_branch": "feature/context-pack",
    "source_base_commit": "aaaaaaaaaaaaaaaaaaaaaaaaaaaaaaaaaaaaaaaa",
    "task": "Implement the development Context Pack P0",
    "next": [
      "Run the contract tests"
    ],
    "discarded": [],
    "open_questions": [],
    "updated_at": "2026-08-12T00:00:00Z",
    "expires_at": "2026-08-13T00:00:00Z"
  },
  "freshness_warnings": [
    {
      "id": "warning:checks_partial",
      "code": "checks_partial",
      "severity": "info",
      "message": "Only a partial validation scope is current."
    }
  ],
  "knowledge": {
    "items": [
      {
        "id": "docs/contract.md",
        "kind": "contract",
        "title": "Application contract",
        "summary": "Rules enforced by kb-core.",
        "freshness": "valid"
      }
    ],
    "omitted_count": 2
  }
}
